{
  "schema_id": "cartulary.reference_pack_fixture_manifest.v1",
  "fixture_id": "rpfx_admission_equivalent_zip",
  "fixture_version": 1,
  "fixture_family": "container_equivalence",
  "input_refs": [
    "contracts/reference-packs/fixtures/admission/equivalent_zip.v1.json"
  ],
  "expected_container_sha256": "0df64d1ee719d9a9d60cee459d9b4040344a1805457ffd537de11f6f92552dcd",
  "expected_manifest_sha256": "6ea5d0df82ca56462258b50add81bf809fa44ffbd0f3bf345c7491ddf1c50162",
  "expected_payload_sha256": "afaae18a960bf0d7f75365494966403333706ee4b7f680ca789c5cad8a237b8f",
  "expected_pack_set_sha256": null,
  "expected_condition": null,
  "expected_issues": [],
  "expected_public_error": null,
  "expected_side_effects": [],
  "forbidden_side_effects": [
    "active_pointer_changed",
    "attestation_appended",
    "audit_event_appended",
    "candidate_created",
    "condition_changed",
    "index_published",
    "job_admitted",
    "network_request_attempted",
    "pack_set_published",
    "payload_bytes_deleted",
    "temporary_state_removed",
    "trust_state_changed"
  ]
}
