{
  "schema_id": "cartulary.reference_pack_fixture_manifest.v1",
  "fixture_id": "rpfx_profile_framework_d3fend_valid",
  "fixture_version": 1,
  "fixture_family": "content_profile",
  "input_refs": [
    "contracts/reference-packs/fixtures/profiles/framework_d3fend_valid.v1.json"
  ],
  "expected_container_sha256": null,
  "expected_manifest_sha256": null,
  "expected_payload_sha256": null,
  "expected_pack_set_sha256": null,
  "expected_condition": null,
  "expected_issues": [],
  "expected_public_error": null,
  "expected_side_effects": [],
  "forbidden_side_effects": [
    "active_pointer_changed",
    "attestation_appended",
    "audit_event_appended",
    "candidate_created",
    "condition_changed",
    "index_published",
    "job_admitted",
    "network_request_attempted",
    "pack_set_published",
    "payload_bytes_deleted",
    "temporary_state_removed",
    "trust_state_changed"
  ]
}
