{
  "schema_id": "cartulary.reference_pack_fixture_manifest.v1",
  "fixture_id": "rpfx_admission_tar_truncated",
  "fixture_version": 1,
  "fixture_family": "archive_attack",
  "input_refs": [
    "contracts/reference-packs/fixtures/admission/tar_truncated.v1.json"
  ],
  "expected_container_sha256": "2eb9c608295210140516e82afee61dbaa628808e534af15daa7a4f21650c16ed",
  "expected_manifest_sha256": null,
  "expected_payload_sha256": null,
  "expected_pack_set_sha256": null,
  "expected_condition": null,
  "expected_issues": [
    {
      "check_id": "archive_structure",
      "severity": "error",
      "phase": "archive_preflight",
      "code": "archive_structure_invalid",
      "path": "$",
      "entry_id": null,
      "safe_details": {
        "limit_id": null,
        "expected_token": null,
        "actual_token": null,
        "related_pack_key": null,
        "related_pack_version": null
      },
      "issue_id": "rpi_53c3b0ea458ec63464f5544a86c4f6a528813e58be7ed0e82b1f137bd489e2e9",
      "reason_code": "archive_structure_invalid"
    }
  ],
  "expected_public_error": {
    "code": "reference_pack_verification_failed",
    "reason_code": "archive_structure_invalid"
  },
  "expected_side_effects": [],
  "forbidden_side_effects": [
    "active_pointer_changed",
    "attestation_appended",
    "audit_event_appended",
    "candidate_created",
    "condition_changed",
    "index_published",
    "job_admitted",
    "network_request_attempted",
    "pack_set_published",
    "payload_bytes_deleted",
    "temporary_state_removed",
    "trust_state_changed"
  ]
}
