{
  "schema_id": "cartulary.reference_pack_fixture_manifest.v1",
  "fixture_id": "rpfx_trust_missing_payloads",
  "fixture_version": 1,
  "fixture_family": "tuf_failure",
  "input_refs": [
    "contracts/reference-pack-fixtures/fixtures/trust/missing_payloads.v1.json"
  ],
  "expected_container_sha256": null,
  "expected_manifest_sha256": null,
  "expected_payload_sha256": null,
  "expected_pack_set_sha256": null,
  "expected_condition": null,
  "expected_issues": [
    {
      "check_id": "target_extra",
      "severity": "error",
      "phase": "target_inventory",
      "code": "unexpected_target",
      "path": "$.metadata[1].signed.targets[0]",
      "entry_id": null,
      "safe_details": {
        "limit_id": null,
        "expected_token": null,
        "actual_token": null,
        "related_pack_key": null,
        "related_pack_version": null
      },
      "issue_id": "rpi_7e7ed1e9baf53383e5fc5368c8139b6554957ea1eacdc896451178182604d4ea",
      "reason_code": "unexpected_target"
    },
    {
      "check_id": "target_extra",
      "severity": "error",
      "phase": "target_inventory",
      "code": "unexpected_target",
      "path": "$.metadata[1].signed.targets[1]",
      "entry_id": null,
      "safe_details": {
        "limit_id": null,
        "expected_token": null,
        "actual_token": null,
        "related_pack_key": null,
        "related_pack_version": null
      },
      "issue_id": "rpi_58be1301a749266415bf85558969e10e462a564ad5699ccabf523745c7e71cca",
      "reason_code": "unexpected_target"
    },
    {
      "check_id": "target_extra",
      "severity": "error",
      "phase": "target_inventory",
      "code": "unexpected_target",
      "path": "$.metadata[1].signed.targets[2]",
      "entry_id": null,
      "safe_details": {
        "limit_id": null,
        "expected_token": null,
        "actual_token": null,
        "related_pack_key": null,
        "related_pack_version": null
      },
      "issue_id": "rpi_08e1595760798001721d8969e800fc7da198b8c3ba0234bbe1750993954b8a3e",
      "reason_code": "unexpected_target"
    }
  ],
  "expected_public_error": {
    "code": "reference_pack_verification_failed",
    "reason_code": "unexpected_target"
  },
  "expected_side_effects": [],
  "forbidden_side_effects": [
    "active_pointer_changed",
    "attestation_appended",
    "audit_event_appended",
    "candidate_created",
    "condition_changed",
    "index_published",
    "job_admitted",
    "network_request_attempted",
    "pack_set_published",
    "payload_bytes_deleted",
    "temporary_state_removed",
    "trust_state_changed"
  ]
}
