{
  "schema_id": "cartulary.reference_pack_fixture_manifest.v1",
  "fixture_id": "rpfx_admission_zip_directory_double_slash",
  "fixture_version": 1,
  "fixture_family": "archive_attack",
  "input_refs": [
    "contracts/reference-pack-fixtures/fixtures/admission/zip_directory_double_slash.v1.json"
  ],
  "expected_container_sha256": "02f5d9bdfa59bb38368758e851c508ce985fb2e1636b799da41f1068fa3d8b65",
  "expected_manifest_sha256": null,
  "expected_payload_sha256": null,
  "expected_pack_set_sha256": null,
  "expected_condition": null,
  "expected_issues": [
    {
      "check_id": "archive_path",
      "severity": "error",
      "phase": "archive_structure",
      "code": "path_traversal",
      "path": "$.archive_members[0]",
      "entry_id": null,
      "safe_details": {
        "limit_id": null,
        "expected_token": null,
        "actual_token": null,
        "related_pack_key": null,
        "related_pack_version": null
      },
      "issue_id": "rpi_fead7116be96a0b066e9d9bbcdb31fb95ecf7c3224db811614a7f6b10d854ecb",
      "reason_code": "path_traversal"
    }
  ],
  "expected_public_error": {
    "code": "reference_pack_verification_failed",
    "reason_code": "path_traversal"
  },
  "expected_side_effects": [],
  "forbidden_side_effects": [
    "active_pointer_changed",
    "attestation_appended",
    "audit_event_appended",
    "candidate_created",
    "condition_changed",
    "index_published",
    "job_admitted",
    "network_request_attempted",
    "pack_set_published",
    "payload_bytes_deleted",
    "temporary_state_removed",
    "trust_state_changed"
  ]
}
