{
  "schema_id": "cartulary.reference_pack_fixture_manifest.v1",
  "fixture_id": "rpfx_admission_license_prohibited",
  "fixture_version": 1,
  "fixture_family": "licensing",
  "input_refs": [
    "contracts/reference-pack-fixtures/fixtures/admission/license_prohibited.v1.json"
  ],
  "expected_container_sha256": null,
  "expected_manifest_sha256": "5008a545d0d679e47426d8fdcb7e7d5874a52c19425656bf425529ec2b6f7cd0",
  "expected_payload_sha256": "e38ff4e85cc452ea298b402bd1003c3ba199db81e9f2fd9a8f3931369965e584",
  "expected_pack_set_sha256": null,
  "expected_condition": null,
  "expected_issues": [],
  "expected_public_error": null,
  "expected_side_effects": [],
  "forbidden_side_effects": [
    "active_pointer_changed",
    "attestation_appended",
    "audit_event_appended",
    "candidate_created",
    "condition_changed",
    "index_published",
    "job_admitted",
    "network_request_attempted",
    "pack_set_published",
    "payload_bytes_deleted",
    "temporary_state_removed",
    "trust_state_changed"
  ]
}
