{
  "schema_id": "cartulary.reference_pack_fixture_manifest.v1",
  "fixture_id": "rpfx_profile_framework_attack_semantic",
  "fixture_version": 1,
  "fixture_family": "content_profile",
  "input_refs": [
    "contracts/reference-pack-fixtures/fixtures/profiles/framework_attack_semantic.v1.json"
  ],
  "expected_container_sha256": null,
  "expected_manifest_sha256": null,
  "expected_payload_sha256": null,
  "expected_pack_set_sha256": null,
  "expected_condition": null,
  "expected_issues": [
    {
      "check_id": "content_semantics",
      "severity": "error",
      "phase": "content_semantics",
      "code": "content_semantic_invalid",
      "path": "$.objects[0].source_refs[0].artifact_index",
      "entry_id": "fixture:1",
      "safe_details": {
        "limit_id": null,
        "expected_token": null,
        "actual_token": null,
        "related_pack_key": null,
        "related_pack_version": null
      },
      "issue_id": "rpi_a9ab63c224f59446f060ad367c190d2578f65bd895382b6dccb82c10d4c7049c",
      "reason_code": "content_semantic_invalid"
    }
  ],
  "expected_public_error": {
    "code": "reference_pack_verification_failed",
    "reason_code": "content_semantic_invalid"
  },
  "expected_side_effects": [],
  "forbidden_side_effects": [
    "active_pointer_changed",
    "attestation_appended",
    "audit_event_appended",
    "candidate_created",
    "condition_changed",
    "index_published",
    "job_admitted",
    "network_request_attempted",
    "pack_set_published",
    "payload_bytes_deleted",
    "temporary_state_removed",
    "trust_state_changed"
  ]
}
