{
  "schema_id": "cartulary.reference_pack_fixture_manifest.v1",
  "fixture_id": "rpfx_trust_rotation_predecessor_only",
  "fixture_version": 1,
  "fixture_family": "tuf_failure",
  "input_refs": [
    "contracts/reference-packs/fixtures/trust/rotation_predecessor_only.v1.json"
  ],
  "expected_container_sha256": null,
  "expected_manifest_sha256": null,
  "expected_payload_sha256": null,
  "expected_pack_set_sha256": null,
  "expected_condition": null,
  "expected_issues": [
    {
      "check_id": "root_rotation",
      "severity": "error",
      "phase": "tuf_metadata",
      "code": "tuf_root_rotation_invalid",
      "path": "$.metadata[0].signatures",
      "entry_id": null,
      "safe_details": {
        "limit_id": null,
        "expected_token": null,
        "actual_token": null,
        "related_pack_key": null,
        "related_pack_version": null
      },
      "issue_id": "rpi_c234354c1b0e3ecc20ebc840cabac47c12efbcbc41b1740a5c18df91b1a8d591",
      "reason_code": "tuf_root_rotation_invalid"
    }
  ],
  "expected_public_error": {
    "code": "reference_pack_verification_failed",
    "reason_code": "tuf_root_rotation_invalid"
  },
  "expected_side_effects": [],
  "forbidden_side_effects": [
    "active_pointer_changed",
    "attestation_appended",
    "audit_event_appended",
    "candidate_created",
    "condition_changed",
    "index_published",
    "job_admitted",
    "network_request_attempted",
    "pack_set_published",
    "payload_bytes_deleted",
    "temporary_state_removed",
    "trust_state_changed"
  ]
}
