{
  "schema_id": "cartulary.reference_pack_fixture_manifest.v1",
  "fixture_id": "rpfx_admission_tar_sparse",
  "fixture_version": 1,
  "fixture_family": "archive_attack",
  "input_refs": [
    "contracts/reference-packs/fixtures/admission/tar_sparse.v1.json"
  ],
  "expected_container_sha256": "1b53b7c10532bdac59b5f8fe032c09692f42dce421f799b397b9b732cf2f30a3",
  "expected_manifest_sha256": null,
  "expected_payload_sha256": null,
  "expected_pack_set_sha256": null,
  "expected_condition": null,
  "expected_issues": [
    {
      "check_id": "archive_member_type",
      "severity": "error",
      "phase": "archive_structure",
      "code": "disallowed_member_type",
      "path": "$.archive_members[0]",
      "entry_id": null,
      "safe_details": {
        "limit_id": null,
        "expected_token": null,
        "actual_token": null,
        "related_pack_key": null,
        "related_pack_version": null
      },
      "issue_id": "rpi_c05574d789275d0a958d9a3390c4741cbdd0c6b3d032625bffb15ad26360ae2c",
      "reason_code": "disallowed_member_type"
    }
  ],
  "expected_public_error": {
    "code": "reference_pack_verification_failed",
    "reason_code": "disallowed_member_type"
  },
  "expected_side_effects": [],
  "forbidden_side_effects": [
    "active_pointer_changed",
    "attestation_appended",
    "audit_event_appended",
    "candidate_created",
    "condition_changed",
    "index_published",
    "job_admitted",
    "network_request_attempted",
    "pack_set_published",
    "payload_bytes_deleted",
    "temporary_state_removed",
    "trust_state_changed"
  ]
}
